{
  "runId": "11111111-1111-1111-1111-111111111111",
  "domain": "claims",
  "sealedAt": "2026-08-20T10:00:00Z",
  "corpusHash": "c1db13ab836db24060490c83b83c089adb1ce9e6e1899d81e02d398cec22e6b1",
  "artefacts": [
    {
      "artefactId": "art-claims-openapi-us",
      "region": "us",
      "system": "git",
      "uri": "https://git.example.internal/claims/openapi-us",
      "version": "8f3c1a2",
      "contentHash": "042896dc1966b8a6214e5383aba5b8b931cfa049d17aafa37eb8a77c859b95da",
      "evidenceTier": 1,
      "sanitisation": {
        "artefactId": "art-claims-openapi-us",
        "contentHash": "042896dc1966b8a6214e5383aba5b8b931cfa049d17aafa37eb8a77c859b95da",
        "labels": ["STRUCTURAL"],
        "verdict": "allow",
        "licenceDisposition": "permitted",
        "policyVersion": 3,
        "classifiedAt": "2026-08-20T09:00:00Z"
      }
    },
    {
      "artefactId": "art-claims-openapi-uk",
      "region": "uk",
      "system": "confluence",
      "uri": "https://confluence.example.internal/pages/claims-uk",
      "version": "42",
      "contentHash": "dba0082ec68e72d47fa926dcc91fb9b00961ceb4342554a0c2aa567144a5a6d3",
      "evidenceTier": 3,
      "sanitisation": {
        "artefactId": "art-claims-openapi-uk",
        "contentHash": "dba0082ec68e72d47fa926dcc91fb9b00961ceb4342554a0c2aa567144a5a6d3",
        "labels": ["STRUCTURAL", "PERSONAL_DATA"],
        "verdict": "mask",
        "licenceDisposition": "permitted",
        "policyVersion": 3,
        "classifiedAt": "2026-08-20T09:05:00Z"
      }
    }
  ],
  "exclusions": [
    {
      "uri": "https://vendor.example.com/partner-api-spec",
      "reason": "licence-blocked",
      "detail": "Vendor licence disposition not yet recorded as permitted.",
      "decidedBy": "integration-architect"
    }
  ]
}
